{
  "task_id": "01_hello_world",
  "variant": "default",
  "framework": "crewai",
  "framework_version": "1.14.6",
  "model_alias": "gemini-2.5-flash",
  "n": 10,
  "n_failed": 0,
  "success_rate": 1.0,
  "stats": {
    "latency_ms": {
      "mean": 1064.6,
      "stdev": 166.4669336535037,
      "p50": 1060.0,
      "p95": 1356.6,
      "p99": 1375.32,
      "min": 828.0,
      "max": 1380.0,
      "ci95_low": 965.8975,
      "ci95_high": 1168.7249999999997
    },
    "cold_start_ms": {
      "mean": 0.0,
      "stdev": 0.0,
      "p50": 0.0,
      "p95": 0.0,
      "p99": 0.0,
      "min": 0.0,
      "max": 0.0,
      "ci95_low": 0.0,
      "ci95_high": 0.0
    },
    "tokens_input": {
      "mean": 77.0,
      "stdev": 0.0,
      "p50": 77.0,
      "p95": 77.0,
      "p99": 77.0,
      "min": 77.0,
      "max": 77.0,
      "ci95_low": 77.0,
      "ci95_high": 77.0
    },
    "tokens_output": {
      "mean": 57.4,
      "stdev": 4.8,
      "p50": 59.0,
      "p95": 59.0,
      "p99": 59.0,
      "min": 43.0,
      "max": 59.0,
      "ci95_low": 54.2,
      "ci95_high": 59.0
    },
    "tokens_cached": {
      "mean": 0.0,
      "stdev": 0.0,
      "p50": 0.0,
      "p95": 0.0,
      "p99": 0.0,
      "min": 0.0,
      "max": 0.0,
      "ci95_low": 0.0,
      "ci95_high": 0.0
    },
    "ram_peak_mb": {
      "mean": 280.924,
      "stdev": 1.5341851257263583,
      "p50": 280.265,
      "p95": 283.96299999999997,
      "p99": 284.3446,
      "min": 279.84,
      "max": 284.44,
      "ci95_low": 280.11897500000003,
      "ci95_high": 281.961
    }
  },
  "cost": {
    "usd_per_run": {
      "mean": 0.00016659999999999998,
      "stdev": 1.1999999999999999e-05,
      "p50": 0.0001706,
      "p95": 0.0001706,
      "p99": 0.0001706,
      "min": 0.0001306,
      "max": 0.0001706,
      "ci95_low": 0.0001586,
      "ci95_high": 0.0001706
    },
    "pricing_table_date": "2026-06-10"
  }
}